{
  "schema_id": "prometheus.rollout",
  "schema_version": 1,
  "rollout_id": "roll-0001",
  "policy_version": "r0-step-1024",
  "task_id": "task-math-0001",
  "env_snapshot_id": "snap-0001",
  "tokens": [
    0,
    17,
    23,
    1
  ],
  "latents": {
    "count": 2,
    "dim": 512,
    "artifact": {
      "content_hash": "60c694d4f320bba059dcceac79a818633ae89497dfe5f855f7bea4fab8c0e0c2",
      "bytes": 4096
    }
  },
  "routing_ids": [
    0,
    1,
    0
  ],
  "topology": {
    "kind": "chain",
    "node_count": 1,
    "edge_count": 0
  },
  "staleness_k": 0,
  "reward": 1.0,
  "reward_evidence_hash": "bd63c702e6fb10f4aa9987f679286f440f5ee1eab6676a498e0ff2787850e6ea",
  "created_at": "2026-09-16T12:00:00Z",
  "completed_at": "2026-09-16T12:00:00Z"
}
